{
  "$schema": "https://json-schema.org/draft/2020-12/schema",
  "$id": "https://forge.local/rubrics/chunk-handoff.schema.json",
  "title": "forge.chunk.v1",
  "description": "Canonical completion handoff from forge-codex-lane. The schema discriminator is top-level; the envelope is never nested under a forge.chunk.v1 key.",
  "type": "object",
  "additionalProperties": true,
  "propertyNames": {
    "not": {
      "pattern": "^forge\\."
    }
  },
  "required": [
    "schema",
    "chunk_id",
    "project",
    "branch",
    "pr",
    "lane",
    "scenarios",
    "check",
    "files_changed",
    "lines_changed",
    "decisions",
    "debt",
    "card_proposals",
    "docs_reconciled",
    "duration_min",
    "worker"
  ],
  "properties": {
    "schema": {
      "const": "forge.chunk.v1"
    },
    "chunk_id": {
      "type": "string",
      "description": "Chunk contract id, e.g. CHUNK-7 or CHUNK-C9.1. Not a decimal integer: the same grammar hermes/board-bootstrap.sh and scripts/acceptance-freeze.sh already enforce on card ids.",
      "pattern": "^CHUNK-[A-Za-z0-9][A-Za-z0-9._-]*$"
    },
    "project": {
      "type": "string",
      "minLength": 1
    },
    "branch": {
      "type": "string",
      "description": "chunk/<id>-<slug>. Byte-identical to the pattern in scripts/prejudge.sh and templates/python-service/template/scripts/branch-name.sh; a fourth dialect is the defect this rule exists to prevent.",
      "pattern": "^chunk/[A-Za-z0-9]+(\\.[A-Za-z0-9]+)*-[a-z0-9]+(-[a-z0-9]+)*$"
    },
    "pr": {
      "type": "string",
      "pattern": "^https://github\\.com/[^/]+/[^/]+/pull/[1-9][0-9]*$"
    },
    "lane": {
      "type": "string",
      "enum": ["forge-codex-lane", "claude-interactive"]
    },
    "scenarios": {
      "type": "object",
      "additionalProperties": false,
      "required": ["added", "passing", "feature_files"],
      "properties": {
        "added": {
          "type": "integer",
          "minimum": 0
        },
        "passing": {
          "type": "integer",
          "minimum": 0
        },
        "feature_files": {
          "type": "array",
          "uniqueItems": true,
          "items": {
            "type": "string",
            "pattern": "\\.feature$"
          }
        }
      }
    },
    "check": {
      "type": "object",
      "additionalProperties": false,
      "required": ["green", "coverage_pct"],
      "properties": {
        "green": {
          "const": true
        },
        "coverage_pct": {
          "type": "number",
          "minimum": 0,
          "maximum": 100
        }
      }
    },
    "files_changed": {
      "type": "integer",
      "minimum": 0
    },
    "lines_changed": {
      "type": "integer",
      "minimum": 0
    },
    "decisions": {
      "$ref": "#/$defs/string_list"
    },
    "debt": {
      "$ref": "#/$defs/string_list"
    },
    "card_proposals": {
      "$ref": "#/$defs/string_list"
    },
    "docs_reconciled": {
      "$ref": "#/$defs/string_list"
    },
    "duration_min": {
      "type": "number",
      "minimum": 0
    },
    "worker": {
      "type": "string",
      "minLength": 1
    },
    "codex_model": {
      "type": "string",
      "minLength": 1,
      "description": "The model Codex's own session rollout says authored the diff, NOT the pin that was requested. Optional and never required: `lane` includes claude-interactive, which has no Codex model at all, and a required field would retroactively invalidate every row valid when written (see the additive rule in kanban-metadata-schema.md)."
    },
    "codex_reasoning_effort": {
      "type": "string",
      "minLength": 1,
      "description": "The `effort` on the same rollout turn_context as codex_model."
    },
    "codex_model_source": {
      "type": "string",
      "enum": ["rollout", "requested"],
      "description": "Where codex_model came from. `rollout` is evidence — Codex said so. `requested` is intent — the rollout could not be read, so this is only what was asked for. Without this marker a failed read degrades provenance to intent silently, which is F22 wearing the fix's clothes."
    },
    "codex_model_requested": {
      "type": "string",
      "minLength": 1,
      "description": "The requested pin, present only when it differs from codex_model. That difference is F22 itself: the operator's ~/.codex/config.toml was rewritten under a running lane."
    }
  },
  "$defs": {
    "string_list": {
      "type": "array",
      "uniqueItems": true,
      "items": {
        "type": "string",
        "minLength": 1
      }
    }
  }
}
